brand_slug,brand_name,category_slug,category_name,verdict,research_summary,ownership_notes,good_fit_when,think_twice_when,source_keys,research_url
bosch,Bosch,dishwashers,Dishwashers,A strong shortlist choice when quiet operation matters and local Bosch service is easy to reach.,"Bosch leads this category in two separate owner studies: J.D. Power ranked it first for dishwasher satisfaction, while ACSI placed it in a tie with LG. Yale Appliance also kept Bosch among its lower-service brands for 2026. Three different measures point in the same direction, which is more useful than one shiny award badge.","The familiar watch points are not dramatic: filters, drain paths, racks and eventually pumps. Premium racks can be surprisingly dear, and condensation drying feels different from a heated-dry machine. Neither issue is a reason to avoid Bosch, but both are worth understanding before the first wet plastic container causes an argument.",You want a quiet machine with a strong current evidence base. | An authorised servicer operates nearby.,Choose more carefully if fast heated drying or cheap replacement racks matter more than noise.,yale2026 | jd2025 | acsi2025 | energyDishwasher,https://appliance-lifespan-guide.masterblaster1.chatgpt.site/brands/bosch/dishwashers
bosch,Bosch,refrigerators,Refrigerators,Consider the refrigerator on its own merits; the famous Bosch dishwasher record does not transfer automatically.,"Bosch refrigerators do not have the same clean run of public category wins as Bosch dishwashers. Yale Appliance's broader Bosch rate stays below ten percent in the first year, but the company also warns that French-door refrigeration is service-heavy across brands. We treat the layout as the first research question and the badge as the second.","Current Bosch French-door designs often appeal to buyers who want separate cooling systems and a restrained exterior. Ice makers, water systems and sealed-system service remain the expensive areas. Ask the local servicer whether Bosch refrigeration is part of its normal workload, not merely whether it repairs Bosch dishwashers.",You want a premium counter-depth layout. | Local Bosch refrigeration service is confirmed.,A simpler top-freezer model may suit a buyer who values easy repair above layout and finish.,yale2026 | energyFridge,https://appliance-lifespan-guide.masterblaster1.chatgpt.site/brands/bosch/refrigerators
electrolux,Electrolux,washers,Washing Machines,A fabric-care-led front-loader that deserves a model and service check rather than a brand-wide leap of faith.,"Electrolux sits level with Bosch in ACSI's 2025 company table, but the public studies we use do not isolate a current Electrolux washer service rate. That gap matters. We can say recent owners report a competitive overall experience; we cannot turn that into a made-up ten-year bearing forecast.","Buyers often come to Electrolux for cycle control and stain treatment. The long-term questions are more ordinary: gasket care, pump access, bearing labour and board availability. Leave the door open after use, use the correct detergent dose and find the filter before the first blocked-drain warning.",Cycle control and fabric care matter. | You have an established Electrolux servicer nearby.,A simple top-loader may be a calmer fit for a household that dislikes gasket maintenance.,acsi2025 | energyWasher,https://appliance-lifespan-guide.masterblaster1.chatgpt.site/brands/electrolux/washers
electrolux,Electrolux,dryers,Clothes Dryers,"Best judged as part of a laundry pair, with vent design and local service doing more work than the badge.","Public 2025 satisfaction tables do not give Electrolux a dryer-category win, and Yale Appliance's headline 2026 list does not publish a separate Electrolux dryer rate. That is thin evidence, not bad evidence. We avoid filling the blank with confidence theatre.","The dryer itself shares familiar wear items with other vented machines: rollers, belts and heating components. Matching controls and stacking can make the Electrolux pair convenient, but a long or dirty vent will hurt it just as readily as any competing dryer.",You are pairing it with a well-suited Electrolux washer. | Your vent route is short and accessible.,Do not pay a matching-set premium if a simpler dryer has better local parts support.,acsi2025 | energyDryer | dryerSafety,https://appliance-lifespan-guide.masterblaster1.chatgpt.site/brands/electrolux/dryers
frigidaire,Frigidaire,ranges,Ranges & Ovens,"A sensible value range, especially when straightforward controls matter more than premium styling.","Frigidaire placed third for freestanding-range satisfaction in J.D. Power's 2025 study, close behind the tied leaders. That result is recent-owner evidence rather than a lifespan promise, but it supports Frigidaire's familiar position in mainstream cooking.",Igniters and elements are the repairs to expect over a long life. Control boards deserve a price check before purchase because a basic range can become uneconomic when one proprietary panel fails. We would also go easy on high-heat self-clean cycles once the oven has some age on it.,You want a mainstream price and familiar controls. | Local independent shops know Frigidaire cooking products.,Feature-heavy models weaken the simple-value argument that makes the brand attractive.,jd2025 | nahb,https://appliance-lifespan-guide.masterblaster1.chatgpt.site/brands/frigidaire/ranges
frigidaire,Frigidaire,refrigerators,Refrigerators,"The value can be good, but choose the layout carefully and price ice-system repairs before buying.","Frigidaire does not receive a separate refrigerator win in the 2025 public studies used here. That leaves category evidence carrying more weight: French-door machines draw more service across brands, while simpler top-freezer layouts remove doors and ice-routing parts.","Frigidaire's broad installed base may help with independent repair familiarity. Still, compressors and control boards are model-specific, and an inexpensive purchase price does not guarantee an inexpensive sealed-system job.",You want a plain top-freezer or uncomplicated side-by-side. | The local service network stocks Frigidaire parts.,A heavily discounted French-door package can become less attractive once ice-maker complexity enters the calculation.,yale2026 | energyFridge,https://appliance-lifespan-guide.masterblaster1.chatgpt.site/brands/frigidaire/refrigerators
ge-appliances,GE Appliances,refrigerators,Refrigerators,"A practical choice where GE service coverage is strong, with side-by-side models carrying the better recent signal.","J.D. Power ranked GE second for side-by-side refrigerator satisfaction in 2025. Yale Appliance's broader GE first-year rate came in below ten percent, while still warning that French-door refrigeration needs more service than simpler appliance categories.","GE's national service structure is the part we like most. Model layout still rules the risk: through-door ice and multiple evaporator zones add comfort, but they also add repair paths. A plain GE refrigerator with good local support can be a very different ownership bet from the most connected Profile model.",Service access is high on your list. | You are considering a simpler GE or side-by-side layout.,Do not pay for extra ice and screen features unless you would still choose the fridge without them.,yale2026 | jd2025 | energyFridge,https://appliance-lifespan-guide.masterblaster1.chatgpt.site/brands/ge-appliances/refrigerators
ge-appliances,GE Appliances,ranges,Ranges & Ovens,GE's service reach makes its mainstream ranges easier to recommend than their feature sheets alone would suggest.,"GE did not lead the freestanding-range segment in J.D. Power's 2025 table, though the Haier group led ACSI's broader cooking category. The useful fact is less glamorous: Yale Appliance points to GE's national service network as a major ownership advantage.","Standard GE ranges use familiar igniters, elements and controls. Profile and Café add finish choices plus more electronics, so the gap in purchase price is not the only gap to price. We would ask what a replacement control panel costs before falling for the pretty knobs.",You want mainstream cooking with broad service reach. | A standard GE model covers the daily job.,"Profile or Café pricing needs a feature you will actually use, not just a coordinated handle.",yale2026 | jd2025 | acsi2025,https://appliance-lifespan-guide.masterblaster1.chatgpt.site/brands/ge-appliances/ranges
ge-appliances,GE Appliances,microwaves,Microwaves,The service network helps built-in buyers; countertop buyers should keep the replacement maths brutally simple.,"GE does not lead the 2025 over-the-range satisfaction result, where Frigidaire ranks first. GE's broader service network is still relevant because an over-the-range or built-in microwave is part appliance and part installation job.","Door switches and turntable motors may justify repair. A magnetron failure in an older countertop model rarely does. For a built-in GE, keep the trim dimensions and model suffix because the cabinet fit may be worth more than the microwave itself.",You need a built-in or over-the-range unit with accessible service. | The model matches an existing GE installation.,A basic countertop buyer gains less from brand service reach and should compare replacement cost first.,jd2025 | microwaveSafety,https://appliance-lifespan-guide.masterblaster1.chatgpt.site/brands/ge-appliances/microwaves
kitchenaid,KitchenAid,dishwashers,Dishwashers,"A credible premium-mainstream dishwasher choice, especially for buyers who care about racks and loading flexibility.","Yale Appliance names KitchenAid with Bosch and Miele among the more reliable dishwasher brands in its 2026 service work. J.D. Power does not place KitchenAid in the public top three for 2025 satisfaction, so the evidence is positive but not unanimous.","KitchenAid's better racks and substantial feel are part of the appeal. Pump, drain and latch failures remain the category watch points, while rack replacement can be expensive enough to influence an older-machine repair decision.",Rack layout matters as much as headline noise level. | Whirlpool-group service is common locally.,Compare a similarly priced Bosch or Miele rather than assuming the full kitchen package is the best deal.,yale2026 | jd2025 | energyDishwasher,https://appliance-lifespan-guide.masterblaster1.chatgpt.site/brands/kitchenaid/dishwashers
kitchenaid,KitchenAid,ranges,Ranges & Ovens,"Buy for the cooking layout and service access, not because the dishwasher reputation followed it across the kitchen.","The current public studies provide a clearer KitchenAid dishwasher signal than a KitchenAid range signal. That doesn't make the ranges poor. It means the model's controls, element layout and parts price deserve more weight than the badge.","Whirlpool-group parts familiarity can help, but premium styling brings premium control panels. Check board and glass-top pricing. If the numbers look silly before purchase, they will not become charming in year eight.",You want a coordinated premium-mainstream look. | Local Whirlpool-group technicians handle the model.,A simpler Whirlpool or GE range may do the same cooking job with cheaper trim and controls.,jd2025 | nahb,https://appliance-lifespan-guide.masterblaster1.chatgpt.site/brands/kitchenaid/ranges
lg,LG,washers,Washing Machines,"One of the strongest current front-load shortlists, provided local LG service is not a weak spot.","Laundry supplies much of LG's 5.5 percent first-year service result in Yale Appliance's 2026 report. J.D. Power ranked LG second for front-load washer satisfaction, while ACSI placed LG first in washers. The studies measure different things and still point in the same direction.","The ownership routine is familiar: air the gasket, clean the pump filter and keep detergent under control. Large drums are useful, but an overloaded five-cubic-foot washer can still punish its bearings. Capacity is permission to wash bulky items, not to compact the entire week into one load.","You want a large, efficient front-loader. | LG warranty and post-warranty service are available nearby.",Choose another brand if local technicians routinely refuse LG work.,yale2026 | jd2025 | acsi2025 | energyWasher,https://appliance-lifespan-guide.masterblaster1.chatgpt.site/brands/lg/washers
lg,LG,dryers,Clothes Dryers,"A strong partner to LG's washers, with current owner satisfaction working in its favour.",LG ranked first for clothes-dryer satisfaction in J.D. Power's 2025 study. Yale Appliance also describes LG laundry as the engine of the brand's low first-year service rate. That is a better foundation than a matching-door argument.,Vented LG dryers still depend on the house duct. Heat-pump and all-in-one models shift the maintenance pattern toward filters and condenser care. Decide which system fits the room before comparing cycle menus.,You are pairing it with an LG front-loader. | You want current heat-pump or large-capacity options.,A basic vented dryer may offer cheaper repairs if energy use and venting are not concerns.,yale2026 | jd2025 | energyDryer | dryerSafety,https://appliance-lifespan-guide.masterblaster1.chatgpt.site/brands/lg/dryers
lg,LG,refrigerators,Refrigerators,"Better current satisfaction than the old internet reputation suggests, but still a more cautious buy than LG laundry.",LG led J.D. Power's 2025 French-door and side-by-side refrigerator segments. Yale Appliance says LG refrigeration is more average than its laundry and reports linear-compressor failure near one in ninety units within five years across a much larger service history.,"That compressor figure is better than the online horror-story pile would suggest, yet service access remains uneven. Ice makers and door systems are the more everyday aggravations. We would buy only after naming the technician who will take the call.",You like the layout and have confirmed LG refrigeration service. | Recent satisfaction results matter more to you than old forum volume.,LG laundry strength should not be used as a shortcut for the refrigerator decision.,yale2026 | jd2025 | energyFridge,https://appliance-lifespan-guide.masterblaster1.chatgpt.site/brands/lg/refrigerators
miele,Miele,dishwashers,Dishwashers,"A premium dishwasher with one of the strongest current service records, if the local repair map supports it.","Yale Appliance reported a 5.5 percent Miele dishwasher service rate for 2026, close to one first-year call for every eighteen units sold. The same report places Miele with Bosch and KitchenAid among the category's reliable names.","The purchase price is high, and replacement racks or controls can keep the premium theme alive. Filtration and descaling still matter. Miele engineering does not repeal hard water, much as the brochure might prefer otherwise.",You plan to own the dishwasher for a long time. | Authorised Miele service is nearby.,Weak local service can erase much of the premium ownership case.,yale2026 | energyDishwasher,https://appliance-lifespan-guide.masterblaster1.chatgpt.site/brands/miele/dishwashers
miele,Miele,washers,Washing Machines,A compact premium washer for buyers who value build and fabric care more than maximum drum size.,"Miele's overall first-year service rate sits at 7.4 percent in Yale Appliance's 2026 report, below one call for every thirteen units in that regional sample. The report describes laundry as consistent, though it does not publish a separate washer rate in the headline table.","Compact capacity changes household rhythm. Smaller loads may mean more cycles, but the machines suit tight spaces and careful fabric routines. Parts and labour cost more than mainstream LG or GE, so the service network has to earn its place in the decision.",Space is tight and fabric care matters. | You have nearby authorised Miele support.,Large-family laundry volume can make compact capacity irritating before reliability ever enters the story.,yale2026 | energyWasher,https://appliance-lifespan-guide.masterblaster1.chatgpt.site/brands/miele/washers
miele,Miele,dryers,Clothes Dryers,"One of the more convincing compact heat-pump options, with capacity and service as the two honest caveats.",Yale Appliance says Miele heat-pump dryers have become more dependable and keeps the brand below ten percent overall first-year service. That current evidence is useful because heat-pump drying has changed quickly over the past few model generations.,"There is no exterior vent, but there are filters and condenser paths to maintain. Drying behaviour feels different from a high-heat vented machine. Buyers who expect identical cycle times may blame the dryer for doing exactly what it was designed to do.",You need ventless compact drying. | Lower heat and fabric care suit the household.,A family running back-to-back bulky loads may prefer a larger conventional dryer.,yale2026 | energyDryer,https://appliance-lifespan-guide.masterblaster1.chatgpt.site/brands/miele/dryers
panasonic,Panasonic,microwaves,Microwaves,"A good cooking-performance shortlist, though public brand-level service evidence remains sparse.","Panasonic's inverter design supplies variable power instead of repeatedly switching full output on and off. That can improve gentle reheating and defrosting. None of the public 2025 and 2026 reliability tables used here isolates Panasonic, so we do not pretend the cooking advantage proves a longer life.","Countertop replacement economics are blunt. Door-switch or turntable repairs may be reasonable, but a major power-system job can meet the price of a new unit quickly. Built-in buyers should protect the trim dimensions and model paperwork.",Even low-power heating matters to you. | You want a countertop unit rather than a matching suite.,Service access and trim continuity matter more than inverter cooking in a permanent built-in installation.,microwaveSafety | jd2025,https://appliance-lifespan-guide.masterblaster1.chatgpt.site/brands/panasonic/microwaves
sharp,Sharp,microwaves,Microwaves,The specialist choice for drawer microwaves and a defensible name for conventional formats.,"Sharp posted a 7.5 percent first-year service rate in Yale Appliance's 2026 report, around one call for every thirteen units sold in that sample. Yale also describes microwaves as a stable category and Sharp as the established drawer brand.",Drawer hardware adds moving parts and makes removal more involved than lifting a countertop box. That convenience can still be worthwhile. Just settle the service question before the electrician and cabinetmaker finish their work.,A drawer format solves a real kitchen-layout problem. | A trained Sharp servicer covers your area.,A countertop microwave is far cheaper and easier to replace when the drawer format is merely decorative.,yale2026 | microwaveSafety,https://appliance-lifespan-guide.masterblaster1.chatgpt.site/brands/sharp/microwaves
speed-queen,Speed Queen,washers,Washing Machines,"The durability-led top-load choice, with smaller capacity and higher resource use sitting plainly on the other side of the scale.","Speed Queen led Yale Appliance's 2026 brand table at a 3.7 percent first-year service rate, close to one call for every twenty-seven machines sold in its sample. The same report compares a 2.7-cubic-foot Speed Queen with a five-cubic-foot LG costing less, a capacity gap close to an extra laundry basket each cycle.","The controls and mechanical layout appeal to buyers tired of screen-heavy washers. Water use is less charming, and bulky bedding can expose the smaller tub quickly. We like the honesty of the machine, but not every household needs to pay for it.",Repairability and familiar mechanics come first. | Normal loads fit the smaller tub.,"Large loads, water cost or energy use can make a mainstream front-loader the better long-term tool.",yale2026 | energyWasher,https://appliance-lifespan-guide.masterblaster1.chatgpt.site/brands/speed-queen/washers
speed-queen,Speed Queen,dryers,Clothes Dryers,"A sturdy conventional dryer, though the brand premium matters less here than it does on the washer.","Speed Queen's low overall first-year service rate includes its laundry-only line, but the headline evidence does not separate washer and dryer rates. Dryers are simpler across brands, so paying the full Speed Queen premium needs a parts, warranty or dealer-service reason beyond matching paint.","Belts, rollers and heating components remain ordinary wear items. The vent behind the dryer can overwhelm any brand advantage, making a clean installation more valuable than a heavy door.",A strong local Speed Queen dealer supports the pair. | You want familiar vented-dryer mechanics.,A simpler mainstream dryer may provide similar repairability for less money.,yale2026 | dryerSafety,https://appliance-lifespan-guide.masterblaster1.chatgpt.site/brands/speed-queen/dryers
whirlpool,Whirlpool,refrigerators,Refrigerators,"A sensible mainstream refrigerator choice, helped by broad service familiarity and a strong 2025 satisfaction signal.","ACSI placed Whirlpool first in refrigerators for 2025. J.D. Power ranked it second among top-mount freezer models, which fits the brand's practical strength in simpler layouts better than a sweeping claim about every French-door machine.","Whirlpool parts and independent-service familiarity are often easier to find than premium European refrigeration support. Ice systems remain ice systems, though. A through-door dispenser adds the same warm-section routing problem regardless of the logo.",You want a mainstream top-freezer or familiar side-by-side. | Independent service access matters.,Do not let a kitchen-package rebate choose a complicated French-door layout for you.,jd2025 | acsi2025 | energyFridge,https://appliance-lifespan-guide.masterblaster1.chatgpt.site/brands/whirlpool/refrigerators
whirlpool,Whirlpool,dryers,Clothes Dryers,"A familiar, repair-friendly dryer category with a strong recent owner-satisfaction result.","Whirlpool tied Samsung at the top of ACSI's 2025 dryer category. The broad parts network is another practical point, especially for basic vented models using familiar belts and heating components.","The dryer's health still depends on airflow. Clean the vent, keep the duct short and investigate longer cycles before ordering parts. A $15 obstruction can imitate a much more expensive failure rather convincingly.",You want a conventional dryer with familiar parts. | Local independent technicians know Whirlpool platforms.,Connected features add little value if the household only uses timed and sensor dry.,acsi2025 | dryerSafety | energyDryer,https://appliance-lifespan-guide.masterblaster1.chatgpt.site/brands/whirlpool/dryers
whirlpool,Whirlpool,ranges,Ranges & Ovens,A strong mainstream cooking choice when simple controls and repair familiarity lead the brief.,"Whirlpool ranked first for cooktop satisfaction and second for wall ovens in J.D. Power's 2025 study. Those results do not isolate freestanding-range lifespan, but they support a good recent ownership experience across cooking products.","Basic Whirlpool ranges benefit from familiar igniters, elements and parts channels. Higher trims add controls that can be expensive later. We would buy the cooking layout we need and leave the app-connected oven light to someone else.",You want mainstream cooking with broad service familiarity. | A simple model meets the household's needs.,Extra electronics weaken the low-drama ownership case.,jd2025 | nahb,https://appliance-lifespan-guide.masterblaster1.chatgpt.site/brands/whirlpool/ranges
whirlpool,Whirlpool,dishwashers,Dishwashers,"A practical service-friendly dishwasher, though Bosch and Miele carry the stronger current reliability story.","Whirlpool placed third for dishwasher satisfaction in J.D. Power's 2025 study. Yale Appliance's 2026 report points instead to Miele, Bosch and KitchenAid as the category's reliability leaders, so Whirlpool looks respectable rather than dominant.","The advantage is familiarity: parts and technicians are often easier to find. Filter design, rack quality and noise vary by model. Compare those physical details because the logo alone will not tell you whether the machine is pleasant to load for nine years.",Local Whirlpool service is easy to obtain. | The exact rack and filter design suit the household.,"At premium pricing, compare Bosch, Miele and KitchenAid before committing.",yale2026 | jd2025 | energyDishwasher,https://appliance-lifespan-guide.masterblaster1.chatgpt.site/brands/whirlpool/dishwashers
